{
  "schema_version": "1.0.0",
  "agent": "指标异常处置SOP技能(wind-farm-anomaly-sop) v3.2",
  "project": "泰康师宗",
  "generated_at": "2026-08-19",
  "trigger": {
    "indicator": "FLE50",
    "period": "2026-04 ~ 2026-05",
    "value": [9.70, 14.03],
    "threshold": 5
  },
  "workorders": [
    {
      "workorder_id": "TK-SZ-F15-变频柜PLC-20260507",
      "title": "泰康师宗·3#集电线F15风机·变频柜PLC超时故障复盘与整改通知",
      "subtype": "超时型",
      "oa_type": "设备预警工单",
      "reason": "2026-05-07 F15 变频柜PLC：停机384.2h（扣夜间128h后有效256.2h），损失42.3万kWh，占5月总损失67.5%",
      "action": "要求远景就 F15 变频柜PLC故障（停机384.2h、有效处理时长256.2h，超疑难24h标准10倍以上）出具复盘分析报告：①故障根因（PLC何故障、为何需箱变送电与直流母线电压测量后才恢复）；②256.2h的耗时构成拆解（诊断、备件等待、维修各段时长）；③未按24h标准完成的原因；④防止同类故障再次超时的具体措施。同时下达整改通知，明确整改项。",
      "target_metric": "复盘报告完整覆盖根因/耗时构成/超时原因/防再发措施四项；同类故障有效处理时长≤24h（不含夜间22:00-06:00）",
      "responsible": { "name": "远景能源", "role": "执行方" },
      "approver": { "name": "我方项目监督岗", "role": "监管方" },
      "deadline_days": 7,
      "deadline_basis": "复盘报告7日内提交；整改措施按整改通知载明期限执行",
      "completion_criteria": "远景提交正式复盘分析报告并经我方评审通过；整改通知所列措施全部落实并经我方现场验证",
      "evidence": [
        {
          "date": "2026-05-07",
          "device": "3#集电线F15风机",
          "fault": "变频柜PLC",
          "detail": "停机384.2h（扣夜间128h后有效256.2h），损失42.3万kWh，占5月总损失67.5%",
          "eam_ref": "F15 变频柜PLC超大停机事件，EAM停机日志原文"
        }
      ],
      "smart": {
        "S": "要求远景就 F15 变频柜PLC故障（停机384.2h、有效处理时长256.2h，超疑难24h标准10倍以上）出具复盘分析报告：①故障根因；②256.2h耗时构成拆解；③未按24h标准完成的原因；④防止同类故障再次超时的具体措施。同时下达整改通知。",
        "M": "复盘报告完整覆盖根因/耗时构成/超时原因/防再发措施四项；同类故障有效处理时长≤24h（不含夜间22:00-06:00）",
        "A": "远景提交正式复盘分析报告并经我方评审通过；整改通知所列措施全部落实并经我方现场验证",
        "R": "执行＝远景能源（被监管方，风机维护责任主体）；监管＝我方项目监督岗（评审、验收、闭环）",
        "T": "复盘报告7日内提交；整改措施按整改通知载明期限执行，我方逐项验收"
      }
    },
    {
      "workorder_id": "TK-SZ-F41-变桨滑环-20260503",
      "title": "泰康师宗·9#集电线F41风机·变桨滑环更换超时复盘",
      "subtype": "超时型",
      "oa_type": "设备预警工单",
      "reason": "2026-05-03 F41 变桨柜PLC模块：停机66.0h（有效46.1h），损失7.3万kWh；处理=更换变桨滑环（远景自研，1件）",
      "action": "要求远景就 F41 变桨柜PLC模块故障（有效处理46.1h，超疑难24h标准22.1h）出具复盘分析：①滑环损坏（PROSPER-21-30A）的根因；②66h停机中诊断与备件等待各占多少；③备件（远景自研滑环）供应为何耗时；④同类滑环问题的快速处置流程。",
      "target_metric": "复盘报告四项内容齐全；同类换件故障有效处理时长≤12h（非常规，不含夜间）",
      "responsible": { "name": "远景能源", "role": "执行方" },
      "approver": { "name": "我方项目监督岗", "role": "监管方" },
      "deadline_days": 7,
      "deadline_basis": "复盘报告7日内提交",
      "completion_criteria": "复盘报告评审通过；防再发措施落实",
      "evidence": [
        {
          "date": "2026-05-03",
          "device": "9#集电线F41风机",
          "fault": "变桨柜PLC模块/变桨滑环",
          "detail": "停机66.0h（有效46.1h），损失7.3万kWh；处理=更换变桨滑环（远景自研，1件）",
          "eam_ref": "F41 变桨柜PLC模块，EAM停机日志原文"
        }
      ],
      "smart": {
        "S": "要求远景就 F41 变桨柜PLC模块故障（有效处理46.1h，超疑难24h标准22.1h）出具复盘分析：①滑环损坏（PROSPER-21-30A）的根因；②66h停机中诊断与备件等待各占多少；③备件（远景自研滑环）供应为何耗时；④同类滑环问题的快速处置流程。",
        "M": "复盘报告四项内容齐全；同类换件故障有效处理时长≤12h（非常规，不含夜间）",
        "A": "复盘报告评审通过；防再发措施落实",
        "R": "执行＝远景能源（被监管方）；监管＝我方项目监督岗",
        "T": "复盘报告7日内提交"
      }
    },
    {
      "workorder_id": "TK-SZ-F08-桨叶螺栓-20260508",
      "title": "泰康师宗·2#集电线F08风机·桨叶螺栓断裂卡滞超时复盘",
      "subtype": "超时型",
      "oa_type": "设备预警工单",
      "reason": "2026-05-08 F08 变桨柜PLC模块：停机43.0h（有效32.0h），“A桨叶螺栓断裂卡滞导致无法回桨，断丝取出后恢复”（EAM原文）",
      "action": "要求远景就 F08 桨叶螺栓断裂卡滞致无法回桨（有效处理32.0h，超非常规12h标准20.0h）出具复盘分析：①螺栓断裂根因（与该项目叶片螺栓批量断裂背景的关系）；②断丝取出作业的耗时构成；③与同项目叶片螺栓普查/更换计划的衔接。",
      "target_metric": "复盘报告齐全；同类机械卡滞故障有效处理时长≤12h（不含夜间）",
      "responsible": { "name": "远景能源", "role": "执行方" },
      "approver": { "name": "我方项目监督岗", "role": "监管方" },
      "deadline_days": 7,
      "deadline_basis": "复盘报告7日内提交",
      "completion_criteria": "复盘报告评审通过",
      "evidence": [
        {
          "date": "2026-05-08",
          "device": "2#集电线F08风机",
          "fault": "桨叶螺栓断裂卡滞",
          "detail": "停机43.0h（有效32.0h），“A桨叶螺栓断裂卡滞导致无法回桨，断丝取出后恢复”",
          "eam_ref": "F08 变桨柜PLC模块，EAM停机日志原文"
        }
      ],
      "smart": {
        "S": "要求远景就 F08 桨叶螺栓断裂卡滞致无法回桨（有效处理32.0h，超非常规12h标准20.0h）出具复盘分析：①螺栓断裂根因；②断丝取出作业耗时构成；③与同项目叶片螺栓普查/更换计划的衔接。",
        "M": "复盘报告齐全；同类机械卡滞故障有效处理时长≤12h（不含夜间）",
        "A": "复盘报告评审通过",
        "R": "执行＝远景能源；监管＝我方项目监督岗",
        "T": "复盘报告7日内提交"
      }
    },
    {
      "workorder_id": "TK-SZ-F14-齿轮箱滤芯-20260417",
      "title": "泰康师宗·3#集电线F14风机·齿轮箱滤芯更换超时复盘",
      "subtype": "超时型",
      "oa_type": "设备预警工单",
      "reason": "2026-04-17 F14 齿轮箱过滤器滤芯：停机48.1h（扣夜间16.1h后有效32.0h），处理=更换滤芯（万和，1个）",
      "action": "要求远景就 F14 齿轮箱过滤器滤芯更换（有效处理32.0h，超疑难24h标准8.0h）出具复盘分析：①滤芯阻塞的成因与油液状态；②例行更换为何耗时32h；③滤芯（NP-240409011）备件库存保障。",
      "target_metric": "复盘报告齐全；同类例行换件有效处理时长≤12h（不含夜间）",
      "responsible": { "name": "远景能源", "role": "执行方" },
      "approver": { "name": "我方项目监督岗", "role": "监管方" },
      "deadline_days": 7,
      "deadline_basis": "复盘报告7日内提交",
      "completion_criteria": "复盘报告评审通过",
      "evidence": [
        {
          "date": "2026-04-17",
          "device": "3#集电线F14风机",
          "fault": "齿轮箱过滤器滤芯",
          "detail": "停机48.1h（扣夜间16.1h后有效32.0h），处理=更换滤芯（万和，1个）",
          "eam_ref": "F14 齿轮箱过滤器滤芯，EAM停机日志原文"
        }
      ],
      "smart": {
        "S": "要求远景就 F14 齿轮箱过滤器滤芯更换（有效处理32.0h，超疑难24h标准8.0h）出具复盘分析：①滤芯阻塞成因与油液状态；②例行更换为何耗时32h；③滤芯备件库存保障。",
        "M": "同类例行换件有效处理时长≤12h（不含夜间）",
        "A": "复盘报告评审通过",
        "R": "执行＝远景能源；监管＝我方项目监督岗",
        "T": "复盘报告7日内提交"
      }
    },
    {
      "workorder_id": "TK-SZ-F14-变桨润滑油泵-20260409",
      "title": "泰康师宗·3#集电线F14风机·变桨润滑油泵更换超时复盘",
      "subtype": "超时型",
      "oa_type": "设备预警工单",
      "reason": "2026-04-09 F14 变桨驱动器（变频器）：停机31.6h（有效23.6h），损失10.2万kWh，处理=更换变桨润滑油泵",
      "action": "要求远景就 F14 变桨驱动器（变频器）故障（有效处理23.6h，超非常规12h标准11.6h）出具复盘分析：①润滑油泵失效根因；②更换作业耗时构成；③该泵与同日变桨柜接触器故障（4-03）的关联性排查。",
      "target_metric": "复盘报告齐全；同类换件有效处理时长≤12h（不含夜间）",
      "responsible": { "name": "远景能源", "role": "执行方" },
      "approver": { "name": "我方项目监督岗", "role": "监管方" },
      "deadline_days": 7,
      "deadline_basis": "复盘报告7日内提交",
      "completion_criteria": "复盘报告评审通过",
      "evidence": [
        {
          "date": "2026-04-09",
          "device": "3#集电线F14风机",
          "fault": "变桨驱动器（变频器）/润滑油泵",
          "detail": "停机31.6h（有效23.6h），损失10.2万kWh，处理=更换变桨润滑油泵",
          "eam_ref": "F14 变桨驱动器（变频器），EAM停机日志原文"
        }
      ],
      "smart": {
        "S": "要求远景就 F14 变桨驱动器（变频器）故障（有效处理23.6h，超非常规12h标准11.6h）出具复盘分析：①润滑油泵失效根因；②更换作业耗时构成；③与同日变桨柜接触器故障（4-03）关联性排查。",
        "M": "同类换件有效处理时长≤12h（不含夜间）",
        "A": "复盘报告评审通过",
        "R": "执行＝远景能源；监管＝我方项目监督岗",
        "T": "复盘报告7日内提交"
      }
    },
    {
      "workorder_id": "TK-SZ-F14-问题机组根因排查-20260405",
      "title": "泰康师宗·3#集电线F14风机·问题机组根因排查与专项培训",
      "subtype": "高频型",
      "oa_type": "设备预警工单",
      "reason": "F14 机组 2026-04~05 故障10次：变桨电源模块×5、驱动器×2、PLC模块、柜接触器、变频电源模块、齿轮箱滤芯；其中 Profibus 通讯线屏蔽层磨破同一问题反复4次",
      "action": "F14 机组 4~5月故障10次（多系统反复，Profibus通讯线屏蔽层磨破同一问题反复4次）。要求远景：①对F14开展整机电气系统根因排查（重点：Profibus通讯线布线与固定方式缺陷、端子排接头磨损）；②针对该项目运维人员开展变桨通讯系统专项培训（通讯回路结构、屏蔽层检查要点、一次修好处置标准）。",
      "target_metric": "F14 次月故障次数≤2次；变桨通讯类故障单次有效处理时长≤12h（不含夜间）；同类通讯问题不得出现第2次返工",
      "responsible": { "name": "远景能源", "role": "执行方" },
      "approver": { "name": "我方项目监督岗", "role": "监管方" },
      "deadline_days": 14,
      "deadline_basis": "根因排查14日内完成；专项培训14日内完成；效果以次月数据验证",
      "completion_criteria": "远景提交F14根因排查报告（含布线整改记录）；专项培训签到与考核记录；次月F14 EAM故障记录验证",
      "evidence": [
        {
          "date": "2026-04-01",
          "device": "3#集电线F14风机",
          "fault": "多系统反复故障（变桨电源模块/驱动器/PLC/变频电源/齿轮箱滤芯）",
          "detail": "4~5月故障10次，Profibus通讯线屏蔽层磨破同一问题 5-13重接→5-15封补→5-20闪断→5-24再封补 反复4次",
          "eam_ref": "F14 机组 2026-04~05 EAM故障记录"
        }
      ],
      "smart": {
        "S": "F14 机组 4~5月故障10次。要求远景：①对F14开展整机电气系统根因排查；②针对该项目运维人员开展变桨通讯系统专项培训。",
        "M": "F14 次月故障次数≤2次；变桨通讯类故障单次有效处理时长≤12h；同类通讯问题不得出现第2次返工",
        "A": "远景提交F14根因排查报告（含布线整改记录）；专项培训签到与考核记录；次月F14 EAM故障记录验证",
        "R": "执行＝远景能源；监管＝我方项目监督岗",
        "T": "根因排查14日内完成；专项培训14日内完成；效果以次月数据验证"
      }
    },
    {
      "workorder_id": "TK-SZ-UPS高频培训-202604",
      "title": "泰康师宗·主控柜UPS高频故障专项培训（I#F03、5#F23机位）",
      "subtype": "高频型",
      "oa_type": "设备预警工单",
      "reason": "I#F03 主控柜UPS：4-12、4-25、5-16等4次；5#F23：4月2次；处理均为“充放电测试，各项指示灯正常，复位后故障消除”",
      "action": "主控柜UPS故障4~5月在同一批机位反复发生（F03 4次、F23 2次，处理均为充放电测试+复位）。要求远景：①排查该项目UPS集中告警的原因（批次寿命/充电回路/告警阈值设置）；②对该项目运维人员开展UPS故障专项培训（告警模式识别、充放电测试标准、更换判据）。",
      "target_metric": "UPS类故障单次有效处理时长≤6h（常规，不含夜间）；重复复位（同一机位月内≥2次同类告警）降为0",
      "responsible": { "name": "远景能源", "role": "执行方" },
      "approver": { "name": "我方项目监督岗", "role": "监管方" },
      "deadline_days": 14,
      "deadline_basis": "专项培训14日内完成",
      "completion_criteria": "专项培训记录；次月同机位UPS重复告警记录为0",
      "evidence": [
        {
          "date": "2026-04-12",
          "device": "1#集电线F03主控柜 / 5#集电线F23主控柜",
          "fault": "主控柜UPS反复告警",
          "detail": "F03 4次（4-12、4-25、5-16等）、F23 2次；处理均为充放电测试+复位",
          "eam_ref": "I#F03、5#F23 主控柜UPS EAM记录"
        }
      ],
      "smart": {
        "S": "主控柜UPS故障4~5月反复发生。要求远景：①排查UPS集中告警原因；②对运维人员开展UPS故障专项培训。",
        "M": "UPS类故障单次有效处理时长≤6h；重复复位降为0",
        "A": "专项培训记录；次月同机位UPS重复告警记录为0",
        "R": "执行＝远景能源；监管＝我方项目监督岗",
        "T": "培训14日内完成"
      }
    },
    {
      "workorder_id": "TK-SZ-DO回路虚接-共性整改-202606",
      "title": "泰康师宗·变桨驱动DO控制回路1号线虚接·共性缺陷整改督办",
      "subtype": "共性缺陷型",
      "oa_type": "设备预警工单",
      "reason": "9#F45（6-06）、8#F38（6-08）、8#F35（7-06）三条EAM记录均为“变桨驱动DO控制回路1号线虚接，整改后故障消除”",
      "action": "变桨驱动DO控制回路1号线虚接已在3台机组出现（9#F45、8#F38、8#F35），属同一线路设计/施工的共性缺陷。要求远景：①对全场机组开展DO控制回路1号线接线状态普查（紧固度、绝缘、走线）；②提交缺陷根因说明（设计/施工/批次）与整改方案；③对已发3台机整改效果复核。",
      "target_metric": "全场普查覆盖率100%；普查后该类故障零新发",
      "responsible": { "name": "远景能源", "role": "执行方" },
      "approver": { "name": "我方项目监督岗", "role": "监管方" },
      "deadline_days": 30,
      "deadline_basis": "全场普查30日内完成；根因说明14日内提交",
      "completion_criteria": "远景提交普查记录（逐机位签字）与缺陷根因说明；次月起DO控制回路类故障EAM记录为0",
      "evidence": [
        {
          "date": "2026-06-06",